{
  "schemaVersion": "model-consistency-scenario/v1",
  "id": "polyglot-project-ranking",
  "description": "Different model profiles should preserve project-aware candidate identity and complete adapter coverage for a polyglot repository.",
  "sourceArtifact": {
    "path": "examples/mcp/polyglot-project-audits.args.json",
    "schemaVersion": "project-audits/v1",
    "argumentName": "projectAudits"
  },
  "toolCall": {
    "toolName": "rank_project_candidates",
    "arguments": {}
  },
  "lockedFields": [
    {
      "path": "summary.auditCoverage",
      "expected": "complete",
      "reason": "Project ranking must preserve complete audit coverage once all fixture roots have registered adapters."
    },
    {
      "path": "summary.candidateCount",
      "expected": 3,
      "reason": "The Kotlin, Python, and web projects each contribute one ranked candidate in this fixture."
    },
    {
      "path": "candidates[0].projectId",
      "expected": "apps/android",
      "reason": "Ranked candidates must preserve their owning project root."
    },
    {
      "path": "candidates[0].projectTargetId",
      "expected": "apps/android:src/main/kotlin/CheckoutCalculator.kt",
      "reason": "Project target IDs are the stable cross-project reference for model and MCP layers."
    },
    {
      "path": "candidates[0].priority",
      "expected": 7,
      "reason": "Project candidate priority must remain tied to deterministic per-audit scoring."
    },
    {
      "path": "candidates[1].projectId",
      "expected": "services/api",
      "reason": "The Python project candidate must remain visible in project ranking output."
    }
  ],
  "allowedVariations": [
    "summary wording",
    "candidate explanation wording",
    "optional detail depth"
  ],
  "unexpectedVariations": [
    "missing project target identity",
    "missing Python project candidate",
    "different candidate count",
    "different project-aware ranking priority"
  ]
}
