{
  "schemaVersion": "model-consistency-scenario/v1",
  "id": "polyglot-project-summary",
  "description": "Different model profiles should preserve project-level audit coverage and unsupported project reporting for a polyglot repository.",
  "sourceArtifact": {
    "path": "examples/mcp/polyglot-project-audits.args.json",
    "schemaVersion": "project-audits/v1",
    "argumentName": "projectAudits"
  },
  "toolCall": {
    "toolName": "summarize_project_audits",
    "arguments": {}
  },
  "lockedFields": [
    {
      "path": "summary.projectCount",
      "expected": 3,
      "reason": "The polyglot fixture has one experimental Kotlin project plus supported JavaScript and Python roots."
    },
    {
      "path": "summary.auditedProjectCount",
      "expected": 3,
      "reason": "The Kotlin, JavaScript, and Python projects are currently audited by registered adapters."
    },
    {
      "path": "summary.unsupportedProjectCount",
      "expected": 0,
      "reason": "The Python root should no longer be reported as unsupported once the adapter is registered."
    },
    {
      "path": "summary.auditCoverage",
      "expected": "complete",
      "reason": "The repo should be reported as fully audited when all fixture roots have registered adapters."
    },
    {
      "path": "summary.untestedCandidateCount",
      "expected": 3,
      "reason": "The Kotlin, Python, and web projects each expose one deterministic test candidate."
    },
    {
      "path": "projects[2].projectId",
      "expected": "services/api",
      "reason": "The Python service root should stay explicitly reported as an audited project."
    }
  ],
  "allowedVariations": [
    "summary wording",
    "project explanation wording",
    "optional detail depth"
  ],
  "unexpectedVariations": [
    "partial audit coverage when all roots are supported",
    "missing Python project root",
    "different project count",
    "missing supported adapter coverage"
  ]
}
