{
  "schemaVersion": "model-consistency-scenario/v1",
  "id": "python-poetry-pytest-plan",
  "description": "Different model profiles should preserve Poetry pytest planning decisions, including the Poetry verification command and package-level add, extend, and defer items.",
  "sourceArtifact": {
    "path": "evals/expected/python-poetry-pytest.audit.json",
    "schemaVersion": "audit/v1"
  },
  "toolCall": {
    "toolName": "generate_test_plan",
    "arguments": {}
  },
  "lockedFields": [
    {
      "path": "summary.verificationCommand",
      "expected": "poetry run pytest",
      "reason": "Poetry pytest fixtures must preserve the project-native verification command."
    },
    {
      "path": "summary.addTestCount",
      "expected": 1,
      "reason": "The untested order service should remain an add-test item."
    },
    {
      "path": "summary.extendTestCount",
      "expected": 1,
      "reason": "The covered discount logic should remain an extend-test item."
    },
    {
      "path": "summary.deferredCount",
      "expected": 1,
      "reason": "The DTO response should stay deferred from direct unit testing."
    },
    {
      "path": "items[0].id",
      "expected": "extend-test:orders/discounts.py",
      "reason": "Covered Poetry package logic should keep a stable extend-test item id."
    },
    {
      "path": "items[0].existingTestPaths[0]",
      "expected": "tests/test_discounts.py",
      "reason": "The adapter must preserve matching pytest evidence."
    },
    {
      "path": "items[0].existingTestEvidence[0].kind",
      "expected": "python-module-import",
      "reason": "Poetry package coverage must retain its direct Python module import proof."
    },
    {
      "path": "items[0].existingTestEvidence[0].usage",
      "expected": "asserted",
      "reason": "The imported discount calculation remains directly asserted."
    },
    {
      "path": "items[1].id",
      "expected": "add-test:orders/order_service.py",
      "reason": "Untested service code should stay a direct unit-test candidate."
    },
    {
      "path": "items[2].id",
      "expected": "defer:orders/order_response.py",
      "reason": "DTO-only dataclass responses should stay covered through consuming boundary tests."
    }
  ],
  "allowedVariations": [
    "summary wording",
    "Python explanation wording",
    "optional detail depth"
  ],
  "unexpectedVariations": [
    "missing Poetry verification command",
    "missing pytest evidence",
    "direct DTO test recommendation",
    "missing order service candidate"
  ]
}
