{
  "schemaVersion": "model-consistency-scenario/v1",
  "id": "python-uv-pytest-plan",
  "description": "Different model profiles should preserve uv pytest planning decisions, including the uv verification command and package-level add, extend, and defer items.",
  "sourceArtifact": {
    "path": "evals/expected/python-uv-pytest.audit.json",
    "schemaVersion": "audit/v1"
  },
  "toolCall": {
    "toolName": "generate_test_plan",
    "arguments": {}
  },
  "lockedFields": [
    {
      "path": "summary.verificationCommand",
      "expected": "uv run pytest",
      "reason": "uv pytest fixtures must preserve the project-native verification command."
    },
    {
      "path": "summary.addTestCount",
      "expected": 1,
      "reason": "The untested payment service should remain an add-test item."
    },
    {
      "path": "summary.extendTestCount",
      "expected": 1,
      "reason": "The covered calculator should remain an extend-test item."
    },
    {
      "path": "summary.deferredCount",
      "expected": 1,
      "reason": "The DTO response should stay deferred from direct unit testing."
    },
    {
      "path": "items[0].id",
      "expected": "extend-test:src/pricing/calculator.py",
      "reason": "Covered uv package logic should keep a stable extend-test item id."
    },
    {
      "path": "items[0].existingTestPaths[0]",
      "expected": "tests/test_calculator.py",
      "reason": "The adapter must preserve matching pytest evidence."
    },
    {
      "path": "items[1].id",
      "expected": "add-test:src/pricing/payment_service.py",
      "reason": "Untested service code should stay a direct unit-test candidate."
    },
    {
      "path": "items[2].id",
      "expected": "defer:src/pricing/payment_response.py",
      "reason": "DTO-only dataclass responses should stay covered through consuming boundary tests."
    }
  ],
  "allowedVariations": [
    "summary wording",
    "Python explanation wording",
    "optional detail depth"
  ],
  "unexpectedVariations": [
    "missing uv verification command",
    "missing pytest evidence",
    "direct DTO test recommendation",
    "missing payment service candidate"
  ]
}
